{
  "schemaVersion" : 1,
  "compiler" : {
    "version" : "0.1.0-SNAPSHOT"
  },
  "inputDigest" : "ec3219fde5fc88fb2beff45f56c0a88a6202dc91dccd9edb52664068dae2d10e",
  "targetProfile" : "v146",
  "success" : true,
  "diagnosticSummary" : {
    "errors" : 0,
    "warnings" : 0
  },
  "totals" : {
    "instructions" : 26,
    "labels" : 3,
    "virtualSlots" : 13,
    "physicalSlots" : 0,
    "objectPoolSlots" : 0,
    "stringSlots" : 0,
    "runtimeSlots" : 0
  },
  "shards" : [ {
    "id" : "Main",
    "processor" : "micro",
    "mlog" : "Main.mlog",
    "ipt" : 2,
    "maxTokensPerStatement" : 5,
    "resources" : {
      "instructions" : 26,
      "labels" : 3,
      "virtualSlots" : 13,
      "physicalSlots" : 0,
      "objectPoolSlots" : 0,
      "stringSlots" : 0,
      "runtimeSlots" : 0
    }
  } ],
  "optimizations" : [ {
    "name" : "constantFolds",
    "shard" : "Main",
    "applied" : 0
  }, {
    "name" : "eliminatedBranches",
    "shard" : "Main",
    "applied" : 0
  }, {
    "name" : "eliminatedLoops",
    "shard" : "Main",
    "applied" : 0
  }, {
    "name" : "eliminatedStatements",
    "shard" : "Main",
    "applied" : 0
  } ]
}
